{
    "logo": {
      "link": "/",
      "src": "/img/logo-springernature-blue.svg",
      "alt": "Logo Header"
    },
    "loggedIn": true,
    "snid": false,
    "loginLink": {
        "url": "/login",
        "dataTrackAction": "login-test",
        "text": "Login",
        "icon": "/img/eds-user-account-medium.svg#eds-i-user-account-medium"
    },
    "accountTitle": "Account",
    "headerNavigation": {
        "navigationText": "Menu",
        "searchText": "Search",
        "iconSearch": "/img/eds-search.svg#eds-i-search",
        "iconMenu": "/img/eds-menu.svg#eds-i-menu",
        "links": [
            {
                "url": "/find-a-journal-test",
                "dataTrackAction": "find-a-journal-test",
                "text": "Find a Journal"
            },
            {
              "url": "/publish-with-us-test",
              "dataTrackAction": "publish-with-us-test",
              "text": "Publish with us"
          }
        ]
    },
    "headerAccount": {
      "text": "Account",
      "links": [
        {
          "url": "/login-test",
          "dataTrackAction": "",
          "text": "Access through your institution"
        },
        {
          "url": "/login-test",
          "dataTrackAction": "",
          "text": "My account"
        },
        {
          "url": "/login-test",
          "dataTrackAction": "",
          "text": "My account bookshelf"
        },
        {
          "url": "/login-test",
          "dataTrackAction": "",
          "text": "logout"
        }
      ]
  
    },
    "headerSearch": {
      "heading": "Search",
      "label": "Search by keyword or author",
      "url": "/search-action",
      "text": "search text",
      "dataTrackAction": "search",
      "icon": "/img/eds-search.svg#eds-i-search"
    }
  }